{
  "id": "eos.plan.demo-saas",
  "project_id": "eos.project.demo-saas",
  "intent_summary": "Build a booking SaaS with architecture, security, testing, and observability coverage.",
  "capability_ids": [
    "eos.capability.design.system-architecture",
    "eos.capability.security.review",
    "eos.capability.quality.test-planning",
    "eos.capability.operations.observability"
  ],
  "artifact_ids": [
    "eos.artifact.demo-saas.architecture",
    "eos.artifact.demo-saas.threat-model",
    "eos.artifact.demo-saas.test-strategy",
    "eos.artifact.demo-saas.observability-plan"
  ],
  "task_ids": [
    "eos.task.demo-saas.design-architecture",
    "eos.task.demo-saas.security-review",
    "eos.task.demo-saas.test-planning",
    "eos.task.demo-saas.observability-design"
  ],
  "gate_ids": ["eos.gate.demo-saas.architecture"],
  "dependencies": [
    {
      "kind": "task_depends_on_task",
      "from": "eos.task.demo-saas.security-review",
      "to": "eos.task.demo-saas.design-architecture"
    },
    {
      "kind": "task_requires_artifact",
      "from": "eos.task.demo-saas.security-review",
      "to": "eos.artifact.demo-saas.architecture"
    },
    {
      "kind": "gate_requires_artifact",
      "from": "eos.gate.demo-saas.architecture",
      "to": "eos.artifact.demo-saas.architecture"
    }
  ],
  "status": "draft",
  "revision": 1
}
